{"commitment":"sha256:fd3ae682dafbec3532e330c79d031e31670c1c8f11f8660392eedcc614e7f04f","envelope":{"action":"REVOKE","audience":"kingdom:offline-shadow","effects":{"authority":"NONE","economic":"NONE","external_receipt":false,"nen_invocation":false,"network_requests":0,"reputation":"NONE","scope":"RECORD_CONSTRUCTION_AND_OFFLINE_VALIDATION_ONLY","score":false,"storage_writes":0,"zerone_transaction":false},"expiry_height":null,"issuer":{"controller_ref":"4d5157663ef4e072e1a35052dc995675c2b5c38ac2cac6d630db65682bf0dafc","key_fingerprint":"ed25519-sha256:34750f98bd59fcfc946da45aaabe933be154a4b5094e1c4abf42866505f3c97e","namespace":"witness-fixture"},"kind":"AGENTTOOL_OFFER","nonclaims":["COMPETENCE","CONSCIOUSNESS","CONSENT","IDENTITY","PERSONHOOD","QUALITY","REPUTATION","TRUTH"],"parent":"sha256:d10e35383c351bedfd244b30b66c36f351588450089f161b014a0f23de3a60df","payload_root":"sha256:f6505f02e05b34a8a058c59b97ad283b8f8affbf680e03c37b9d1585e3e8bc9b","policy_digest":"sha256:d21777bcf688bd904a786aa810a31b8ba8c3306d5e2d0046ba51833bdf4b2d96","protocol":"kingdom.witnessed-agent-economy/0.1","schema_hash":"sha256:7eae4752f652a1d1e7fac391a74a0285dae2267ecac36cc6483dc4e53fab1a94","sequence":"3","subject_ref":"4f57975416d9cd037cfd4919e676d75cee9e8b7e00328248e9d7f22680b47fda"},"payload":{"authority_sequence":"12","offer_commitment":"sha256:d10e35383c351bedfd244b30b66c36f351588450089f161b014a0f23de3a60df","offer_document_digest":"sha256:56c229408a713111541065597b3b97d595924cff3adfa0405b0b7d173d25ab2c","offer_ref":"4f57975416d9cd037cfd4919e676d75cee9e8b7e00328248e9d7f22680b47fda","reason_digest":"sha256:7574b0acb61f4fe0703ebe0bd72b9e79a36176e0ae8d0370535c5d964a3c6e68","visibility":"PUBLIC"},"signature":{"algorithm":"Ed25519","public_key":"8a88e3dd7409f195fd52db2d3cba5d72ca6709bf1d94121bf3748801b40f6f5c","value":"98e3185a129a20bccf6a9ed81264d9545dd05dd7fda5d588b49349dac6977238fa2449c05e7130558795feb9c51bb3a9a1aefb50cc47df9e5480a379e3af2301"}}