{"commitment":"sha256:6a119b1ba96f2f98e4712bef1eb2e36994f774c3d040e487b07d35612a928853","envelope":{"action":"WITHDRAW","audience":"kingdom:offline-shadow","effects":{"authority":"NONE","economic":"NONE","external_receipt":false,"nen_invocation":false,"network_requests":0,"reputation":"NONE","scope":"RECORD_CONSTRUCTION_AND_OFFLINE_VALIDATION_ONLY","score":false,"storage_writes":0,"zerone_transaction":false},"expiry_height":null,"issuer":{"controller_ref":"4d5157663ef4e072e1a35052dc995675c2b5c38ac2cac6d630db65682bf0dafc","key_fingerprint":"ed25519-sha256:34750f98bd59fcfc946da45aaabe933be154a4b5094e1c4abf42866505f3c97e","namespace":"witness-fixture"},"kind":"AGENTTOOL_PUBLIC_RECOGNITION","nonclaims":["COMPETENCE","CONSCIOUSNESS","CONSENT","IDENTITY","PERSONHOOD","QUALITY","REPUTATION","TRUTH"],"parent":"sha256:40bc5e1d06dc55ae3207fd3986b4e1dfc2e067135504d9b2edcd60ee221588fa","payload_root":"sha256:9dcb077f5fce113112da931738daf1805da116e6165de70d72b89287effa1dd7","policy_digest":"sha256:d21777bcf688bd904a786aa810a31b8ba8c3306d5e2d0046ba51833bdf4b2d96","protocol":"kingdom.witnessed-agent-economy/0.1","schema_hash":"sha256:a3ece9072d305b86568abf275e53dbc6e31e025edad007fbc721f0082141fc8a","sequence":"2","subject_ref":"40407b3b779a02a0cb881040326c8013cb85542987406849c8f4dcb4e8566bdf"},"payload":{"adoption_commitment":"sha256:40bc5e1d06dc55ae3207fd3986b4e1dfc2e067135504d9b2edcd60ee221588fa","authority_sequence":"2","reason_digest":"sha256:4074c8cb0c19b4bd62ee0830845f2d4c184f37579fd50f3c440b55cde4d6734f","recognition_ref":"40407b3b779a02a0cb881040326c8013cb85542987406849c8f4dcb4e8566bdf","registry_digest":"sha256:d1fc8aaef6c54610cd26e83151a43ecafa04eb14c7f21cf8ce36e7af2fd3a812","surface_digest":"sha256:71c677ea11c65760c008b7b42c5721698b84a1752d07d51f32268c7d387e5830","visibility":"PUBLIC","withdrawal_document_digest":"sha256:a0082889bafda8f90825248819c2b3cc0fe2bf350d9e963d70493d028a274d03"},"signature":{"algorithm":"Ed25519","public_key":"8a88e3dd7409f195fd52db2d3cba5d72ca6709bf1d94121bf3748801b40f6f5c","value":"5b3fcf2840c6661892c329b413e51a36965ef0598181d763e34b97102053bbdf74aecdbdc66312d3b3c4bb6ceacb48b51620171b567becb53c7cfc6be6dad503"}}