{"commitment":"sha256:54f722aa976bdd02772ad5c9327d18201371ac29cacb447c8043c6fc22adbae8","envelope":{"action":"CHECKPOINT","audience":"kingdom:offline-shadow","effects":{"authority":"NONE","economic":"NONE","external_receipt":false,"nen_invocation":false,"network_requests":0,"reputation":"NONE","scope":"RECORD_CONSTRUCTION_AND_OFFLINE_VALIDATION_ONLY","score":false,"storage_writes":0,"zerone_transaction":false},"expiry_height":null,"issuer":{"controller_ref":"4d5157663ef4e072e1a35052dc995675c2b5c38ac2cac6d630db65682bf0dafc","key_fingerprint":"ed25519-sha256:34750f98bd59fcfc946da45aaabe933be154a4b5094e1c4abf42866505f3c97e","namespace":"witness-fixture"},"kind":"COLLABORATION_CHECKPOINT","nonclaims":["COMPETENCE","CONSCIOUSNESS","CONSENT","IDENTITY","PERSONHOOD","QUALITY","REPUTATION","TRUTH"],"parent":null,"payload_root":"sha256:e74c1cd27c2cabea2bdef79833e6328697d85e3bf90b9ea6ad81d47495739e19","policy_digest":"sha256:d21777bcf688bd904a786aa810a31b8ba8c3306d5e2d0046ba51833bdf4b2d96","protocol":"kingdom.witnessed-agent-economy/0.1","schema_hash":"sha256:637307571a43ee9a593499bc87219bb2eb29cff5a3136fcb224e7327ccff3d53","sequence":"1","subject_ref":"6ca9c9c0b7239466695601fc1b54a53761b96beeb27088d6fc4be48eabfd47ba"},"payload":{"epoch_ref":"sha256:bc90e6cf35fad3e94bb9dbbfca2b53d4e44c9549b83e42faa3c50b0a316d30aa","event_count":"10","event_head_hash":"sha256:d7f1b0848a6ec4438dc1b8b8f9d0cd2e8ac129a9a78a417d24a30417aa2dca72","event_head_sequence":"10","participant_set_root":"sha256:fac56d1782da157786b381e88534eff4bd2c36e8a05c365c25a5a8a5d39acfe9","workspace_ref":"6ca9c9c0b7239466695601fc1b54a53761b96beeb27088d6fc4be48eabfd47ba"},"signature":{"algorithm":"Ed25519","public_key":"8a88e3dd7409f195fd52db2d3cba5d72ca6709bf1d94121bf3748801b40f6f5c","value":"4d86f4f375db50246f0a6e03d9d37de4711ad0a87e043ef756755c8489f20e8c354829edd61825c3401d98a3b30fb3ca49e10b3c0a3f7342e8ff15a8b4edcf06"}}