{"commitment":"sha256:2bb9aca373237284d946098c8800db87ac3122ace8381001cb042741dcede022","envelope":{"action":"CHECKPOINT","audience":"kingdom:offline-shadow","effects":{"authority":"NONE","economic":"NONE","external_receipt":false,"nen_invocation":false,"network_requests":0,"reputation":"NONE","scope":"RECORD_CONSTRUCTION_AND_OFFLINE_VALIDATION_ONLY","score":false,"storage_writes":0,"zerone_transaction":false},"expiry_height":null,"issuer":{"controller_ref":"4d5157663ef4e072e1a35052dc995675c2b5c38ac2cac6d630db65682bf0dafc","key_fingerprint":"ed25519-sha256:34750f98bd59fcfc946da45aaabe933be154a4b5094e1c4abf42866505f3c97e","namespace":"witness-fixture"},"kind":"AGENTTOOL_SETTLEMENT_ROOT","nonclaims":["COMPETENCE","CONSCIOUSNESS","CONSENT","IDENTITY","PERSONHOOD","QUALITY","REPUTATION","TRUTH"],"parent":"sha256:40e52b144b08ab568f0aea705db6ffd93dec81830eed7655fd2c21a57dfae03c","payload_root":"sha256:8fa25eac1eb673380ba71247e2646e2e715c1ed7f6b3f7f0a0660e1f55cfd311","policy_digest":"sha256:d21777bcf688bd904a786aa810a31b8ba8c3306d5e2d0046ba51833bdf4b2d96","protocol":"kingdom.witnessed-agent-economy/0.1","schema_hash":"sha256:34dfb9cc5add4301ccb9bb80038416b2ef843b89b48ef19d6c039a19575f7d59","sequence":"2","subject_ref":"c497fac66f5049800c478168c3ffa72686f925ca5c183abce6adf87ccfb9cb06"},"payload":{"declared_gaps":[],"first_sequence":"2","last_sequence":"2","merkle_root":"sha256:1400606f1239a551ed24599b01d5eb75bd79e7bdc12136b24ef2f37ac5b5a363","previous_batch":"sha256:40e52b144b08ab568f0aea705db6ffd93dec81830eed7655fd2c21a57dfae03c","receipt_count":"1","receipt_protocol":"agenttool.settlement-receipt/1","receipt_schema_digest":"sha256:c1ed7143a64b00e22c835c258bf96149f72c46305d00f449e4c61cb654c380b2","receipt_uniqueness_scope":"BATCH_ONLY","source_sequence_binding":"PROJECTION_ONLY"},"signature":{"algorithm":"Ed25519","public_key":"8a88e3dd7409f195fd52db2d3cba5d72ca6709bf1d94121bf3748801b40f6f5c","value":"5f8e1c22ef55142db34cbcf42361aaadfc66f6404c07ec5b38754c0cb8a855efe5795db78c0e5041036ce27cd7f3416973470194b21289296adfc353568bc808"}}