{"commitment":"sha256:e8f1b74b934b6bcd379945ec1793ddb7d3ad21853eb68a149db8c511baedb9f5","envelope":{"action":"CHECKPOINT","audience":"kingdom:offline-shadow","effects":{"authority":"NONE","economic":"NONE","external_receipt":false,"nen_invocation":false,"network_requests":0,"reputation":"NONE","scope":"RECORD_CONSTRUCTION_AND_OFFLINE_VALIDATION_ONLY","score":false,"storage_writes":0,"zerone_transaction":false},"expiry_height":null,"issuer":{"controller_ref":"4d5157663ef4e072e1a35052dc995675c2b5c38ac2cac6d630db65682bf0dafc","key_fingerprint":"ed25519-sha256:34750f98bd59fcfc946da45aaabe933be154a4b5094e1c4abf42866505f3c97e","namespace":"witness-fixture"},"kind":"ARTIFACT_LINEAGE","nonclaims":["COMPETENCE","CONSCIOUSNESS","CONSENT","IDENTITY","PERSONHOOD","QUALITY","REPUTATION","TRUTH"],"parent":null,"payload_root":"sha256:2f5e1c6ea4612ec95047ffd4e2ace4931f1acc4da581d7164da96d46efa66ced","policy_digest":"sha256:d21777bcf688bd904a786aa810a31b8ba8c3306d5e2d0046ba51833bdf4b2d96","protocol":"kingdom.witnessed-agent-economy/0.1","schema_hash":"sha256:60bd4992d30dfc6b699b2814ab3e8d152852866eeb40c9b97041f2a8070b4436","sequence":"1","subject_ref":"751018de211a027d6378a0b6d1e00f4e2e4df9adf3609e49a355fef3a4260427"},"payload":{"downstream_ref":"751018de211a027d6378a0b6d1e00f4e2e4df9adf3609e49a355fef3a4260427","evidence_digest":"sha256:455359676cfbc08cc8aced2e5e7f91254ab85c1b6cb0e8fd22bc7b6889463fad","relation":"DERIVES_FROM","upstream_ref":"0d371b53954066f4b7af98e91dda6e46063923a15d42868838abafa731b55a8e"},"signature":{"algorithm":"Ed25519","public_key":"8a88e3dd7409f195fd52db2d3cba5d72ca6709bf1d94121bf3748801b40f6f5c","value":"2e7f21a0b7535e18945e3b690a940eb3e9a937761ed4447bd0cc4f281c644c5c186177c4db0011da2870faef838a0d722b2e0d7a385ade9a8a7026d5d4274603"}}