{"commitment":"sha256:16a6815a414ff5ef83f1f3d48d9be100f77fe87e5ba155396258b2485d6abe4c","envelope":{"action":"ROTATE","audience":"kingdom:offline-shadow","effects":{"authority":"NONE","economic":"NONE","external_receipt":false,"nen_invocation":false,"network_requests":0,"reputation":"NONE","scope":"RECORD_CONSTRUCTION_AND_OFFLINE_VALIDATION_ONLY","score":false,"storage_writes":0,"zerone_transaction":false},"expiry_height":null,"issuer":{"controller_ref":"4d5157663ef4e072e1a35052dc995675c2b5c38ac2cac6d630db65682bf0dafc","key_fingerprint":"ed25519-sha256:34750f98bd59fcfc946da45aaabe933be154a4b5094e1c4abf42866505f3c97e","namespace":"witness-fixture"},"kind":"ISSUER_KEY_CONTINUITY","nonclaims":["COMPETENCE","CONSCIOUSNESS","CONSENT","IDENTITY","PERSONHOOD","QUALITY","REPUTATION","TRUTH"],"parent":null,"payload_root":"sha256:55a46812c750ce01418334d9212c7f0eafe1da695d2673cd414e219335b5615d","policy_digest":"sha256:d21777bcf688bd904a786aa810a31b8ba8c3306d5e2d0046ba51833bdf4b2d96","protocol":"kingdom.witnessed-agent-economy/0.1","schema_hash":"sha256:13bd04c9e3c882c1bd3b5061a2dbfc867a96cc5d4e777ffe4978f22f56b72cef","sequence":"1","subject_ref":"4d5157663ef4e072e1a35052dc995675c2b5c38ac2cac6d630db65682bf0dafc"},"payload":{"next_key_fingerprint":"ed25519-sha256:6a3803d5f059902a1c6dafbc9ba4729212f7caac08634cc3ae76b27529f03827","previous_key_fingerprint":"ed25519-sha256:34750f98bd59fcfc946da45aaabe933be154a4b5094e1c4abf42866505f3c97e","rotation_digest":"sha256:783bda7302703d70ba7909e0fe6f1c2058f0291698ebab120b88c6fce45950bb"},"signature":{"algorithm":"Ed25519","public_key":"8a88e3dd7409f195fd52db2d3cba5d72ca6709bf1d94121bf3748801b40f6f5c","value":"5c66a0e13d0dbc1a194b7bab167bb0ffc445d32739ddd21f9f71a6f43f68a7c5bb94bc0ac8351caa154d6cb3caa3ae07112a92c8da79d158e82b8027ff900308"}}