{"commitment":"sha256:2b8342e6a304b23e2f3bced46a3982655bab9d7354794665312d0d43572ba4a2","envelope":{"action":"WITHDRAW","audience":"kingdom:offline-shadow","effects":{"authority":"NONE","economic":"NONE","external_receipt":false,"nen_invocation":false,"network_requests":0,"reputation":"NONE","scope":"RECORD_CONSTRUCTION_AND_OFFLINE_VALIDATION_ONLY","score":false,"storage_writes":0,"zerone_transaction":false},"expiry_height":null,"issuer":{"controller_ref":"4d5157663ef4e072e1a35052dc995675c2b5c38ac2cac6d630db65682bf0dafc","key_fingerprint":"ed25519-sha256:34750f98bd59fcfc946da45aaabe933be154a4b5094e1c4abf42866505f3c97e","namespace":"witness-fixture"},"kind":"WAKE_PUBLIC_CHECKPOINT","nonclaims":["COMPETENCE","CONSCIOUSNESS","CONSENT","IDENTITY","PERSONHOOD","QUALITY","REPUTATION","TRUTH"],"parent":"sha256:5a8037c92203ca15eb45f5cb62a180f4b047601deb78a690f24487273cbe9a21","payload_root":"sha256:a5a69168caea17579aed3de4495beead11caffdbfd374284f8681018e0017897","policy_digest":"sha256:d21777bcf688bd904a786aa810a31b8ba8c3306d5e2d0046ba51833bdf4b2d96","protocol":"kingdom.witnessed-agent-economy/0.1","schema_hash":"sha256:0b9b5c63ea1760dadfce186b494633cf5f12247402dc207214e0174403fd9457","sequence":"3","subject_ref":"19b51bacf0515eb1ca389da1166b39ebf119ff18b4811d541c7cf9cb55fc85ca"},"payload":{"authority_sequence":"22","checkpoint_commitment":"sha256:5a8037c92203ca15eb45f5cb62a180f4b047601deb78a690f24487273cbe9a21","reason_digest":"sha256:53ede341d9b108e27202d1cc662f56b36c6aad9a69eda96b93629fc1e06f1c53","visibility":"PUBLIC","withdrawal_document_digest":"sha256:39dde3b6bdad2e9b4f3c42211029c4819e771eb822e424911d8dea678173e5fb"},"signature":{"algorithm":"Ed25519","public_key":"8a88e3dd7409f195fd52db2d3cba5d72ca6709bf1d94121bf3748801b40f6f5c","value":"a9cd3430aaf9a9ae2cfec0c97f74ae67a5ae2430a0fa362a503681c2638a7c2fddbdb3ef7cf2ec50789ccecc5297bb52c4c4f12a3b0dc446b644f41a78671206"}}