{"commitment":"sha256:794503e9cb41821e766ebf36c945f41231c9f3487794fee647d8357ce413a259","envelope":{"action":"GRANT","audience":"kingdom:offline-shadow","effects":{"authority":"NONE","economic":"NONE","external_receipt":false,"nen_invocation":false,"network_requests":0,"reputation":"NONE","scope":"RECORD_CONSTRUCTION_AND_OFFLINE_VALIDATION_ONLY","score":false,"storage_writes":0,"zerone_transaction":false},"expiry_height":null,"issuer":{"controller_ref":"4d5157663ef4e072e1a35052dc995675c2b5c38ac2cac6d630db65682bf0dafc","key_fingerprint":"ed25519-sha256:34750f98bd59fcfc946da45aaabe933be154a4b5094e1c4abf42866505f3c97e","namespace":"witness-fixture"},"kind":"AGENTTOOL_CAPABILITY","nonclaims":["COMPETENCE","CONSCIOUSNESS","CONSENT","IDENTITY","PERSONHOOD","QUALITY","REPUTATION","TRUTH"],"parent":null,"payload_root":"sha256:dce76c7bac2c538370d1a60ac4bd92c198a14cbeac9c25ac264a98bbd5b17be9","policy_digest":"sha256:d21777bcf688bd904a786aa810a31b8ba8c3306d5e2d0046ba51833bdf4b2d96","protocol":"kingdom.witnessed-agent-economy/0.1","schema_hash":"sha256:0ee2f39395842e43b76a89b04a18c5f25a125f220a3aeac2694d9972c44a5148","sequence":"1","subject_ref":"50acb7dda78679544fe4ed527f609afc4e636bd7f123fef184588fc89e94f5cf"},"payload":{"asset_ref":"sha256:24089c64c839d25a0f207f5fd805fc30f8a3846dd45970bab498386e4baa2480","capability_ref":"50acb7dda78679544fe4ed527f609afc4e636bd7f123fef184588fc89e94f5cf","grant_digest":"sha256:4aac1837fcd9039fff5a38c82ffceb0e66e799a9132cc6a4fed7209cfd203fb2","max_per_consume_minor":"10","max_total_minor":"25"},"signature":{"algorithm":"Ed25519","public_key":"8a88e3dd7409f195fd52db2d3cba5d72ca6709bf1d94121bf3748801b40f6f5c","value":"5b54ec914195c48a2c1f2ab10efd9d321cc17171bfc94c35d707898d81da6da3cdb8fcf019115fce56b696cc28238ee7db0d320be48f4237289e358bbecb620f"}}