{"commitment":"sha256:7e6d00e686d5e7f7baac127e062fdd850d7f3469e5910254c3ca4ff2c87f4f2c","envelope":{"action":"PUBLISH","audience":"kingdom:offline-shadow","effects":{"authority":"NONE","economic":"NONE","external_receipt":false,"nen_invocation":false,"network_requests":0,"reputation":"NONE","scope":"RECORD_CONSTRUCTION_AND_OFFLINE_VALIDATION_ONLY","score":false,"storage_writes":0,"zerone_transaction":false},"expiry_height":null,"issuer":{"controller_ref":"4d5157663ef4e072e1a35052dc995675c2b5c38ac2cac6d630db65682bf0dafc","key_fingerprint":"ed25519-sha256:34750f98bd59fcfc946da45aaabe933be154a4b5094e1c4abf42866505f3c97e","namespace":"witness-fixture"},"kind":"AGENTTOOL_OFFER","nonclaims":["COMPETENCE","CONSCIOUSNESS","CONSENT","IDENTITY","PERSONHOOD","QUALITY","REPUTATION","TRUTH"],"parent":null,"payload_root":"sha256:dee47c6e9e64ad61a6c0a44636536c133a31ba7452a4642eb61a93d765c55973","policy_digest":"sha256:d21777bcf688bd904a786aa810a31b8ba8c3306d5e2d0046ba51833bdf4b2d96","protocol":"kingdom.witnessed-agent-economy/0.1","schema_hash":"sha256:7eae4752f652a1d1e7fac391a74a0285dae2267ecac36cc6483dc4e53fab1a94","sequence":"1","subject_ref":"4f57975416d9cd037cfd4919e676d75cee9e8b7e00328248e9d7f22680b47fda"},"payload":{"authority_sequence":"10","capability_root":"sha256:5084309c11d5cfc71296c49dd6d79ffa92ef0e1d9d1f7262c7042faaec1979ad","offer_document_digest":"sha256:fbc485c91b822de608b7a511c7f0abbf0d31369442f157dc5626e0b3b39c06e6","offer_ref":"4f57975416d9cd037cfd4919e676d75cee9e8b7e00328248e9d7f22680b47fda","pricing_root":"sha256:f61c4a4f7fc3cb98d5caf76ec09aa2a35f0c14cc619f0a2829fda1dc1e63c07e","revision":"1","sla_root":"sha256:d93183406d321c0855b77525c1a5aa1736f1f638c6c4bc093a673b042702cc22","terms_digest":"sha256:b7a5323563e693e5ab865c3a0be4c10d68093add52b8897b0f4783083931cc12","visibility":"PUBLIC"},"signature":{"algorithm":"Ed25519","public_key":"8a88e3dd7409f195fd52db2d3cba5d72ca6709bf1d94121bf3748801b40f6f5c","value":"43f8d38a7ca705a3b53cf7a064aee3bca473c968cc9e0cc761ca03053cc8bf79778c6afe0afdf2c90f0c48741ebd29e3928788c5b80e5caec226f12544c00c06"}}