{"commitment":"sha256:93cc5767bf8780f991d3d1a1d70fa5a476d904e00b021767aa6bf79f0db6c914","envelope":{"action":"CONSUME","audience":"kingdom:offline-shadow","effects":{"authority":"NONE","economic":"NONE","external_receipt":false,"nen_invocation":false,"network_requests":0,"reputation":"NONE","scope":"RECORD_CONSTRUCTION_AND_OFFLINE_VALIDATION_ONLY","score":false,"storage_writes":0,"zerone_transaction":false},"expiry_height":null,"issuer":{"controller_ref":"4d5157663ef4e072e1a35052dc995675c2b5c38ac2cac6d630db65682bf0dafc","key_fingerprint":"ed25519-sha256:34750f98bd59fcfc946da45aaabe933be154a4b5094e1c4abf42866505f3c97e","namespace":"witness-fixture"},"kind":"AGENTTOOL_CAPABILITY","nonclaims":["COMPETENCE","CONSCIOUSNESS","CONSENT","IDENTITY","PERSONHOOD","QUALITY","REPUTATION","TRUTH"],"parent":"sha256:794503e9cb41821e766ebf36c945f41231c9f3487794fee647d8357ce413a259","payload_root":"sha256:faab75198cfba93ad107fae6342a42dcd35f46593ed5f8aa2b2ae829c50548a6","policy_digest":"sha256:d21777bcf688bd904a786aa810a31b8ba8c3306d5e2d0046ba51833bdf4b2d96","protocol":"kingdom.witnessed-agent-economy/0.1","schema_hash":"sha256:0ee2f39395842e43b76a89b04a18c5f25a125f220a3aeac2694d9972c44a5148","sequence":"2","subject_ref":"50acb7dda78679544fe4ed527f609afc4e636bd7f123fef184588fc89e94f5cf"},"payload":{"amount_minor":"7","asset_ref":"sha256:24089c64c839d25a0f207f5fd805fc30f8a3846dd45970bab498386e4baa2480","capability_ref":"50acb7dda78679544fe4ed527f609afc4e636bd7f123fef184588fc89e94f5cf","grant_commitment":"sha256:794503e9cb41821e766ebf36c945f41231c9f3487794fee647d8357ce413a259","nullifier":"sha256:462b53e09e2f35ed8009fa4d118dde8d87d04a64dfe9ca7279425e9ec73da899","source_event_digest":"sha256:4deff1ce41bb508e39d4c81d78c21508200a26649ab56e26bed136e85554b455"},"signature":{"algorithm":"Ed25519","public_key":"8a88e3dd7409f195fd52db2d3cba5d72ca6709bf1d94121bf3748801b40f6f5c","value":"55ea0264537daba1aea22c475cb8ee169c92b84275e22e780575df776a8f702944309ba399318197f65a820fbba11ba9575822da9e704f087429979004cc5d05"}}