{"commitment":"sha256:d10e35383c351bedfd244b30b66c36f351588450089f161b014a0f23de3a60df","envelope":{"action":"SUPERSEDE","audience":"kingdom:offline-shadow","effects":{"authority":"NONE","economic":"NONE","external_receipt":false,"nen_invocation":false,"network_requests":0,"reputation":"NONE","scope":"RECORD_CONSTRUCTION_AND_OFFLINE_VALIDATION_ONLY","score":false,"storage_writes":0,"zerone_transaction":false},"expiry_height":null,"issuer":{"controller_ref":"4d5157663ef4e072e1a35052dc995675c2b5c38ac2cac6d630db65682bf0dafc","key_fingerprint":"ed25519-sha256:34750f98bd59fcfc946da45aaabe933be154a4b5094e1c4abf42866505f3c97e","namespace":"witness-fixture"},"kind":"AGENTTOOL_OFFER","nonclaims":["COMPETENCE","CONSCIOUSNESS","CONSENT","IDENTITY","PERSONHOOD","QUALITY","REPUTATION","TRUTH"],"parent":"sha256:7e6d00e686d5e7f7baac127e062fdd850d7f3469e5910254c3ca4ff2c87f4f2c","payload_root":"sha256:846e6cf8fc8b211d54c50443ad959119e53216f195f6da494c832bdd2281c1c8","policy_digest":"sha256:d21777bcf688bd904a786aa810a31b8ba8c3306d5e2d0046ba51833bdf4b2d96","protocol":"kingdom.witnessed-agent-economy/0.1","schema_hash":"sha256:7eae4752f652a1d1e7fac391a74a0285dae2267ecac36cc6483dc4e53fab1a94","sequence":"2","subject_ref":"4f57975416d9cd037cfd4919e676d75cee9e8b7e00328248e9d7f22680b47fda"},"payload":{"authority_sequence":"11","capability_root":"sha256:6d3b69a3121fc28225dfc347b5588178dab695dbaaafe09b2a3270cf7d077aaf","offer_document_digest":"sha256:7cedb538ef7b9d034071b9c88e4cdaff1a0030ec715183b46cf937df601bb2fa","offer_ref":"4f57975416d9cd037cfd4919e676d75cee9e8b7e00328248e9d7f22680b47fda","pricing_root":"sha256:41f0849a441148c01a16221a52cb2c6fee4daabccf33a038d28dd5f359065c44","revision":"2","sla_root":"sha256:cd770ed23c6383e3def076a638500be52b42756dff0040a47b42b6b39ab38f34","supersedes":"sha256:7e6d00e686d5e7f7baac127e062fdd850d7f3469e5910254c3ca4ff2c87f4f2c","terms_digest":"sha256:2175072f4775339b9b8d4833d8eedc83151086a2bb7e8757ff37179a32db8970","visibility":"PUBLIC"},"signature":{"algorithm":"Ed25519","public_key":"8a88e3dd7409f195fd52db2d3cba5d72ca6709bf1d94121bf3748801b40f6f5c","value":"d4a908db17e81e5abd12c7c64438a4e8c220fb6887dbf59d75192b3185d650a89ecc5b0bba85d78a81b6d47cc03c7a4462855ea3b4d591408233c89368a4b60a"}}