{"commitment":"sha256:a743d254e3e7fe5e91fe9a49ddf3fbbc4dcc24d2aa710b56caeaaf690b294eba","envelope":{"action":"CHECKPOINT","audience":"kingdom:offline-shadow","effects":{"authority":"NONE","economic":"NONE","external_receipt":false,"nen_invocation":false,"network_requests":0,"reputation":"NONE","scope":"RECORD_CONSTRUCTION_AND_OFFLINE_VALIDATION_ONLY","score":false,"storage_writes":0,"zerone_transaction":false},"expiry_height":null,"issuer":{"controller_ref":"4d5157663ef4e072e1a35052dc995675c2b5c38ac2cac6d630db65682bf0dafc","key_fingerprint":"ed25519-sha256:34750f98bd59fcfc946da45aaabe933be154a4b5094e1c4abf42866505f3c97e","namespace":"witness-fixture"},"kind":"WAKE_PUBLIC_CHECKPOINT","nonclaims":["COMPETENCE","CONSCIOUSNESS","CONSENT","IDENTITY","PERSONHOOD","QUALITY","REPUTATION","TRUTH"],"parent":null,"payload_root":"sha256:1677b747015c56687c7518479c857f64c2bedeab368f56e9aee90e8d28e34602","policy_digest":"sha256:d21777bcf688bd904a786aa810a31b8ba8c3306d5e2d0046ba51833bdf4b2d96","protocol":"kingdom.witnessed-agent-economy/0.1","schema_hash":"sha256:0b9b5c63ea1760dadfce186b494633cf5f12247402dc207214e0174403fd9457","sequence":"1","subject_ref":"19b51bacf0515eb1ca389da1166b39ebf119ff18b4811d541c7cf9cb55fc85ca"},"payload":{"authority_sequence":"20","boundaries_root":"sha256:925de105ee76c696158bd0ee8077468b2c532d7d619198172bbb6ae6197cc8e5","capability_root":"sha256:b4d119a5cd4fc2aa10b5c7c8a034076dbda9911faf3e9bfccb7a7df96860c9cb","contract_root":"sha256:b20723c261a898bdbee8ac85e039d8cfa3a18a5ac46bd1446ab7eed02e3ad9cb","pricing_root":"sha256:268acf2e098ee5e0e3e3616cdc8adf15d6c55aca5c63827d9ad1c7b248786f0b","protocols_root":"sha256:3aa7ec52127abb0924eed812b156b51ac3f13fb7c2920d57cbed4531ec1b8ea7","public_contract_protocol":"agenttool.public-wake-contract/0.1","public_contract_schema_digest":"sha256:b995da19ad744e57894f2b7a0af3348588f2b77d849f18e79a5858bb79607e0b"},"signature":{"algorithm":"Ed25519","public_key":"8a88e3dd7409f195fd52db2d3cba5d72ca6709bf1d94121bf3748801b40f6f5c","value":"73f541e558f7f7d930a1f41499eb2230ccd81083e0c5634b921d9f5c105d303af437db397ef32179991d2f49586e8cb37523c68526be1a4f297525868d7f5500"}}