{"commitment":"sha256:1f7b7343de9a7dfe0add77ca2bc07672106a9e7f6b5edb475afcc785eae19ecd","envelope":{"action":"SETTLE","audience":"kingdom:offline-shadow","effects":{"authority":"NONE","economic":"NONE","external_receipt":false,"nen_invocation":false,"network_requests":0,"reputation":"NONE","scope":"RECORD_CONSTRUCTION_AND_OFFLINE_VALIDATION_ONLY","score":false,"storage_writes":0,"zerone_transaction":false},"expiry_height":null,"issuer":{"controller_ref":"4d5157663ef4e072e1a35052dc995675c2b5c38ac2cac6d630db65682bf0dafc","key_fingerprint":"ed25519-sha256:34750f98bd59fcfc946da45aaabe933be154a4b5094e1c4abf42866505f3c97e","namespace":"witness-fixture"},"kind":"DISPUTE_TERMINAL","nonclaims":["COMPETENCE","CONSCIOUSNESS","CONSENT","IDENTITY","PERSONHOOD","QUALITY","REPUTATION","TRUTH"],"parent":null,"payload_root":"sha256:dcb8d3f09d77f4480e923a49f08231ff76af545fef3c3bda7320b90282ca9f0f","policy_digest":"sha256:d21777bcf688bd904a786aa810a31b8ba8c3306d5e2d0046ba51833bdf4b2d96","protocol":"kingdom.witnessed-agent-economy/0.1","schema_hash":"sha256:afa816d536e8321404a2c71c81d9478fdb6374b9b7acee436d07e05d5a0d54bb","sequence":"1","subject_ref":"7f684f592e4669553722143761c0cb721ac801bafa0ab08103a3bcdd2b44ee08"},"payload":{"decision_digest":"sha256:6f501b6d65c53780b355343241034a82c85114cd80de1857e5698ee001263ce0","distribution_root":"sha256:23e0f7b9862983f6dcd37d7dbda2afc5313ac2a493fb2fdb0941b335ad3b2f7c","outcome":"SPLIT","settlement_commitment":"sha256:b6fa46d3a2f39ffaae5cc2421fc7f0c0d1b4635299d8e2fc21f2842404ad0a9a"},"signature":{"algorithm":"Ed25519","public_key":"8a88e3dd7409f195fd52db2d3cba5d72ca6709bf1d94121bf3748801b40f6f5c","value":"1f6007100017e09beda3b1280199fe9db0e2215336c894550a5a4c5e598aea36a870ec97cc4a80d96deebd4acec2c1399c72277410626a3820cc24c0295afd0b"}}