{"commitment":"sha256:40e52b144b08ab568f0aea705db6ffd93dec81830eed7655fd2c21a57dfae03c","envelope":{"action":"CHECKPOINT","audience":"kingdom:offline-shadow","effects":{"authority":"NONE","economic":"NONE","external_receipt":false,"nen_invocation":false,"network_requests":0,"reputation":"NONE","scope":"RECORD_CONSTRUCTION_AND_OFFLINE_VALIDATION_ONLY","score":false,"storage_writes":0,"zerone_transaction":false},"expiry_height":null,"issuer":{"controller_ref":"4d5157663ef4e072e1a35052dc995675c2b5c38ac2cac6d630db65682bf0dafc","key_fingerprint":"ed25519-sha256:34750f98bd59fcfc946da45aaabe933be154a4b5094e1c4abf42866505f3c97e","namespace":"witness-fixture"},"kind":"AGENTTOOL_SETTLEMENT_ROOT","nonclaims":["COMPETENCE","CONSCIOUSNESS","CONSENT","IDENTITY","PERSONHOOD","QUALITY","REPUTATION","TRUTH"],"parent":null,"payload_root":"sha256:da68317d83e3b081c4fa613a9c8009134736b079740a08a50af3c8f8288672a9","policy_digest":"sha256:d21777bcf688bd904a786aa810a31b8ba8c3306d5e2d0046ba51833bdf4b2d96","protocol":"kingdom.witnessed-agent-economy/0.1","schema_hash":"sha256:34dfb9cc5add4301ccb9bb80038416b2ef843b89b48ef19d6c039a19575f7d59","sequence":"1","subject_ref":"c497fac66f5049800c478168c3ffa72686f925ca5c183abce6adf87ccfb9cb06"},"payload":{"declared_gaps":[],"first_sequence":"1","last_sequence":"1","merkle_root":"sha256:f3d076b37d0af235d50e4f43c567da1e1f34136db0cfd7ae6cd7ed652de0ec19","previous_batch":null,"receipt_count":"1","receipt_protocol":"agenttool.settlement-receipt/1","receipt_schema_digest":"sha256:c1ed7143a64b00e22c835c258bf96149f72c46305d00f449e4c61cb654c380b2","receipt_uniqueness_scope":"BATCH_ONLY","source_sequence_binding":"PROJECTION_ONLY"},"signature":{"algorithm":"Ed25519","public_key":"8a88e3dd7409f195fd52db2d3cba5d72ca6709bf1d94121bf3748801b40f6f5c","value":"746f6e7618c41a2c64b9548a132afe46312136ffd39bf13338ac2634f4f82ed412b9e876e0037e3e32167e2d65d5829e61a45cb40221eda6f24d55d790e74507"}}