{"commitment":"sha256:447e8da426540d5b01911a66731278f6f72dcc003313c952ec799b882e09ded5","envelope":{"action":"REVOKE","audience":"kingdom:offline-shadow","effects":{"authority":"NONE","economic":"NONE","external_receipt":false,"nen_invocation":false,"network_requests":0,"reputation":"NONE","scope":"RECORD_CONSTRUCTION_AND_OFFLINE_VALIDATION_ONLY","score":false,"storage_writes":0,"zerone_transaction":false},"expiry_height":null,"issuer":{"controller_ref":"4d5157663ef4e072e1a35052dc995675c2b5c38ac2cac6d630db65682bf0dafc","key_fingerprint":"ed25519-sha256:6a3803d5f059902a1c6dafbc9ba4729212f7caac08634cc3ae76b27529f03827","namespace":"witness-fixture"},"kind":"ISSUER_KEY_CONTINUITY","nonclaims":["COMPETENCE","CONSCIOUSNESS","CONSENT","IDENTITY","PERSONHOOD","QUALITY","REPUTATION","TRUTH"],"parent":"sha256:16a6815a414ff5ef83f1f3d48d9be100f77fe87e5ba155396258b2485d6abe4c","payload_root":"sha256:b8669f4cef7dfe4dffaff2b5de72e528f456446d8d8359b4ff27db3742ae5698","policy_digest":"sha256:d21777bcf688bd904a786aa810a31b8ba8c3306d5e2d0046ba51833bdf4b2d96","protocol":"kingdom.witnessed-agent-economy/0.1","schema_hash":"sha256:13bd04c9e3c882c1bd3b5061a2dbfc867a96cc5d4e777ffe4978f22f56b72cef","sequence":"2","subject_ref":"4d5157663ef4e072e1a35052dc995675c2b5c38ac2cac6d630db65682bf0dafc"},"payload":{"reason_digest":"sha256:663a81b0415fbd6db742509730cec8a59b5861c80076b124601d366a8543e381","revoked_key_fingerprint":"ed25519-sha256:6a3803d5f059902a1c6dafbc9ba4729212f7caac08634cc3ae76b27529f03827"},"signature":{"algorithm":"Ed25519","public_key":"8139770ea87d175f56a35466c34c7ecccb8d8a91b4ee37a25df60f5b8fc9b394","value":"31efb2d70116faac1b5ab9c5fdaca6e0b1fb5cc3d97b47c44faeeabfe594666e33e498c1bbcffbabd9b0ca73fdb2cfbab81e0f7668a7ec327b3f8a46c57a0f09"}}