{"commitment":"sha256:6e7158e67e09638b808d4d2a5846d6b98d39441c96e9f23d53c2ca7a51033e48","envelope":{"action":"CHECKPOINT","audience":"kingdom:offline-shadow","effects":{"authority":"NONE","economic":"NONE","external_receipt":false,"nen_invocation":false,"network_requests":0,"reputation":"NONE","scope":"RECORD_CONSTRUCTION_AND_OFFLINE_VALIDATION_ONLY","score":false,"storage_writes":0,"zerone_transaction":false},"expiry_height":null,"issuer":{"controller_ref":"4d5157663ef4e072e1a35052dc995675c2b5c38ac2cac6d630db65682bf0dafc","key_fingerprint":"ed25519-sha256:34750f98bd59fcfc946da45aaabe933be154a4b5094e1c4abf42866505f3c97e","namespace":"witness-fixture"},"kind":"KINGDOM_RELEASE_ROOT","nonclaims":["COMPETENCE","CONSCIOUSNESS","CONSENT","IDENTITY","PERSONHOOD","QUALITY","REPUTATION","TRUTH"],"parent":null,"payload_root":"sha256:ac8f5edc62e8051dbc39a2039778db30ab3e4a5f427d78490e8aa220184235f6","policy_digest":"sha256:d21777bcf688bd904a786aa810a31b8ba8c3306d5e2d0046ba51833bdf4b2d96","protocol":"kingdom.witnessed-agent-economy/0.1","schema_hash":"sha256:15edb7e1726b1b23c117fc956f810a77437563062ae78040ad9ed367f1c120a9","sequence":"1","subject_ref":"4307b791fc85bf3996c0ef3520c3323fe7a0e61595a6d5fcab39b5ce23443828"},"payload":{"build_manifest_digest":"sha256:d0d1ae037d8b5a96259d6faad6afdeb0275bdeabb97402b86a441c7d7eb2654c","deployment_manifest_digest":"sha256:061a5e3e38879b916955093b712c8ab0e217f46f71786c7b4fc135bb2022c7a0","entry_count":"83","entry_merkle_root":"sha256:7db5bd7ed82eabba472eaeb3bdf2cd5a857dfd92d04951318e7842127dd73586","git_commit":"sha1:1111111111111111111111111111111111111111","git_tree":"sha1:2222222222222222222222222222222222222222","ledger_document_digest":"sha256:3037a42de1c92fc12255468e61450f38b0801b793edd267bfc7d30471a290afe","ledger_protocol":"kingdom.immutable-publications/1","previous_release":null,"release_ref":"4307b791fc85bf3996c0ef3520c3323fe7a0e61595a6d5fcab39b5ce23443828","verifier_digest":"sha256:39ce90554670d68999721cef8b6e8cea4cdf4d67301284350fe5aeea0e9bea84","verifier_protocol":"kingdom.ledger-verifier/1"},"signature":{"algorithm":"Ed25519","public_key":"8a88e3dd7409f195fd52db2d3cba5d72ca6709bf1d94121bf3748801b40f6f5c","value":"e7a77e1a76b7996499aa159375ffd6bd881f123052ed5af74c91ca168bd18f5ccf6da946cb56a833fcbb4ecbfd0479589735bd9f5b388aab760e2fa0478a8808"}}