{"commitment":"sha256:f6dc5ac4782e22e54beda10f210a0719a02dd1de75a03491973de0f715a7fc25","envelope":{"action":"REVOKE","audience":"kingdom:offline-shadow","effects":{"authority":"NONE","economic":"NONE","external_receipt":false,"nen_invocation":false,"network_requests":0,"reputation":"NONE","scope":"RECORD_CONSTRUCTION_AND_OFFLINE_VALIDATION_ONLY","score":false,"storage_writes":0,"zerone_transaction":false},"expiry_height":null,"issuer":{"controller_ref":"4d5157663ef4e072e1a35052dc995675c2b5c38ac2cac6d630db65682bf0dafc","key_fingerprint":"ed25519-sha256:34750f98bd59fcfc946da45aaabe933be154a4b5094e1c4abf42866505f3c97e","namespace":"witness-fixture"},"kind":"AGENTTOOL_CAPABILITY","nonclaims":["COMPETENCE","CONSCIOUSNESS","CONSENT","IDENTITY","PERSONHOOD","QUALITY","REPUTATION","TRUTH"],"parent":"sha256:93cc5767bf8780f991d3d1a1d70fa5a476d904e00b021767aa6bf79f0db6c914","payload_root":"sha256:8311befcda992516d4d871de78a2e621625387b8e04d821bf405a68e0509c418","policy_digest":"sha256:d21777bcf688bd904a786aa810a31b8ba8c3306d5e2d0046ba51833bdf4b2d96","protocol":"kingdom.witnessed-agent-economy/0.1","schema_hash":"sha256:0ee2f39395842e43b76a89b04a18c5f25a125f220a3aeac2694d9972c44a5148","sequence":"3","subject_ref":"50acb7dda78679544fe4ed527f609afc4e636bd7f123fef184588fc89e94f5cf"},"payload":{"capability_ref":"50acb7dda78679544fe4ed527f609afc4e636bd7f123fef184588fc89e94f5cf","grant_commitment":"sha256:794503e9cb41821e766ebf36c945f41231c9f3487794fee647d8357ce413a259","reason_digest":"sha256:7f6d3e931b286b74fd13c188ec3378d61e4208747513f94a701d56ebf77aeff7"},"signature":{"algorithm":"Ed25519","public_key":"8a88e3dd7409f195fd52db2d3cba5d72ca6709bf1d94121bf3748801b40f6f5c","value":"20beb9ca13ce8f6eebd04327ff056b161e3bdad8b9e4ea7fb9621f5e3d1c6b452be49957de24b30c13e93d9f3dd303e22f91248da37219d89630757ee6ed120a"}}