{"commitment":"sha256:a4a09830671fba2ce43e6114ba4acb4725af350cab35f4c0b00361bb6ceece9f","envelope":{"action":"GRANT","audience":"kingdom:offline-shadow","effects":{"authority":"NONE","economic":"NONE","external_receipt":false,"nen_invocation":false,"network_requests":0,"reputation":"NONE","scope":"RECORD_CONSTRUCTION_AND_OFFLINE_VALIDATION_ONLY","score":false,"storage_writes":0,"zerone_transaction":false},"expiry_height":null,"issuer":{"controller_ref":"4d5157663ef4e072e1a35052dc995675c2b5c38ac2cac6d630db65682bf0dafc","key_fingerprint":"ed25519-sha256:34750f98bd59fcfc946da45aaabe933be154a4b5094e1c4abf42866505f3c97e","namespace":"witness-fixture"},"kind":"AGENTTOOL_CAPABILITY","nonclaims":["COMPETENCE","CONSCIOUSNESS","CONSENT","IDENTITY","PERSONHOOD","QUALITY","REPUTATION","TRUTH"],"parent":null,"payload_root":"sha256:57dc171b85e9b531a834e3d40a4e6e42b01f6c2a79c44ec0c071616b84c93151","policy_digest":"sha256:d21777bcf688bd904a786aa810a31b8ba8c3306d5e2d0046ba51833bdf4b2d96","protocol":"kingdom.witnessed-agent-economy/0.1","schema_hash":"sha256:0ee2f39395842e43b76a89b04a18c5f25a125f220a3aeac2694d9972c44a5148","sequence":"1","subject_ref":"d47abac4863de8450c6a6bc6d9811af4a6072d0cfdabd5979152bf31b16c3ef3"},"payload":{"asset_ref":"sha256:e6f84bc88ae08504f1b65afd291e7450ce22fbef48fe17c93c7e6f82d5ce5f2f","capability_ref":"d47abac4863de8450c6a6bc6d9811af4a6072d0cfdabd5979152bf31b16c3ef3","grant_digest":"sha256:eb77757bc0b3bb9edaf489b895e577e3098a569c85234cc0f60c7814ec8b68a7","max_per_consume_minor":"18446744073709551615","max_total_minor":"18446744073709551615"},"signature":{"algorithm":"Ed25519","public_key":"8a88e3dd7409f195fd52db2d3cba5d72ca6709bf1d94121bf3748801b40f6f5c","value":"17d2a12e92a79d22ab1d676db995f1575a1df12e952062316da8c3cb1449a36748275e5bb40a4939fdeb5d2d39df54627efe4a5c7bde972578b43ac836310e0f"}}