{"commitment":"sha256:5a8037c92203ca15eb45f5cb62a180f4b047601deb78a690f24487273cbe9a21","envelope":{"action":"SUPERSEDE","audience":"kingdom:offline-shadow","effects":{"authority":"NONE","economic":"NONE","external_receipt":false,"nen_invocation":false,"network_requests":0,"reputation":"NONE","scope":"RECORD_CONSTRUCTION_AND_OFFLINE_VALIDATION_ONLY","score":false,"storage_writes":0,"zerone_transaction":false},"expiry_height":null,"issuer":{"controller_ref":"4d5157663ef4e072e1a35052dc995675c2b5c38ac2cac6d630db65682bf0dafc","key_fingerprint":"ed25519-sha256:34750f98bd59fcfc946da45aaabe933be154a4b5094e1c4abf42866505f3c97e","namespace":"witness-fixture"},"kind":"WAKE_PUBLIC_CHECKPOINT","nonclaims":["COMPETENCE","CONSCIOUSNESS","CONSENT","IDENTITY","PERSONHOOD","QUALITY","REPUTATION","TRUTH"],"parent":"sha256:a743d254e3e7fe5e91fe9a49ddf3fbbc4dcc24d2aa710b56caeaaf690b294eba","payload_root":"sha256:4f9df74ef2c9092b25067bd8f298bd2ae4b6ebd86672431dc8b7edb5e79b18c3","policy_digest":"sha256:d21777bcf688bd904a786aa810a31b8ba8c3306d5e2d0046ba51833bdf4b2d96","protocol":"kingdom.witnessed-agent-economy/0.1","schema_hash":"sha256:0b9b5c63ea1760dadfce186b494633cf5f12247402dc207214e0174403fd9457","sequence":"2","subject_ref":"19b51bacf0515eb1ca389da1166b39ebf119ff18b4811d541c7cf9cb55fc85ca"},"payload":{"authority_sequence":"21","boundaries_root":"sha256:6b9dcd7ba815973f81cd6d5ca1f09dc7c32c5a99d4b9678ac6c091eba13fa4b4","capability_root":"sha256:c9c18a47ed1ca9402cddb50dbe0be2e6d0ce52783b6b2163ea6c5fc40c866dd4","contract_root":"sha256:3b68c3194c939a2906ecd070a6bd6bc097e02f44b24e46c45f4c75ee29228cfd","pricing_root":"sha256:5f390d0111287ccecbaede23f04f2a34876756844444a35156931b77dcfe9cee","protocols_root":"sha256:bc367aa82935c3a3aa9a661f469f5bc3f421b01249ede59fea64c86ac374ca23","public_contract_protocol":"agenttool.public-wake-contract/0.1","public_contract_schema_digest":"sha256:b995da19ad744e57894f2b7a0af3348588f2b77d849f18e79a5858bb79607e0b","supersedes":"sha256:a743d254e3e7fe5e91fe9a49ddf3fbbc4dcc24d2aa710b56caeaaf690b294eba"},"signature":{"algorithm":"Ed25519","public_key":"8a88e3dd7409f195fd52db2d3cba5d72ca6709bf1d94121bf3748801b40f6f5c","value":"e3d9b64fdda96d281e690f3ca30975c528bd97701cf1c2b33f69ead8a3319de8cb78ba5dc2a1fe28ecf2c93a140987ebd2d327d5e72933806b55dee8c4e81a09"}}